{
  "_managed_by": "base_project",
  "_note": "Optional catalog read by the /plugins command. Add entries here to extend the catalog — no code changes needed elsewhere. Re-run the installer after editing to sync.",
  "profiles": {
    "minimal": ["headroom", "ponytail"],
    "design": ["skill-ui", "emil-design-eng", "impeccable", "taste-skill", "styleseed", "ux-ui-agent-skills"],
    "full": [
      "playwright",
      "supabase",
      "strix",
      "skill-ui",
      "emil-design-eng",
      "impeccable",
      "taste-skill",
      "styleseed",
      "ux-ui-agent-skills",
      "example-skills",
      "headroom",
      "ruflo",
      "ponytail"
    ]
  },
  "catalog": [
    {
      "id": "playwright",
      "name": "Playwright MCP",
      "kind": "mcp",
      "summary": "Drives a real browser via natural language, using the accessibility tree (no vision model, no screenshots). Good for validating UI changes end-to-end.",
      "recommend_if": "package.json depends on react/vue/svelte/next/nuxt/angular, or the project has an index.html / vite.config / webpack.config — i.e. it has a frontend to click through.",
      "source": "https://playwright.dev/mcp/introduction",
      "claude": { "scope": "local", "command": "npx", "args": ["-y", "@playwright/mcp@latest"] },
      "opencode": { "command": "npx", "args": ["-y", "@playwright/mcp@latest"] }
    },
    {
      "id": "supabase",
      "name": "Supabase MCP",
      "kind": "mcp",
      "summary": "Lets the agent manage tables, run SQL, and read project config directly against a Supabase project.",
      "recommend_if": "package.json/requirements has a supabase dependency, or a supabase/ folder with config.toml exists.",
      "source": "https://supabase.com/docs/guides/ai-tools/mcp",
      "requires_input": ["SUPABASE_ACCESS_TOKEN (personal access token, from the Supabase dashboard)", "project-ref (from the project URL)"],
      "claude": { "scope": "local", "command": "npx", "args": ["-y", "@supabase/mcp-server-supabase@latest", "--read-only", "--project-ref=<project-ref>"], "env": { "SUPABASE_ACCESS_TOKEN": "<token>" } },
      "opencode": { "command": "npx", "args": ["-y", "@supabase/mcp-server-supabase@latest", "--read-only", "--project-ref=<project-ref>"], "env": { "SUPABASE_ACCESS_TOKEN": "<token>" } }
    },
    {
      "id": "toolbox-postgres",
      "name": "PostgreSQL (Google MCP Toolbox)",
      "kind": "mcp",
      "summary": "Google's MCP Toolbox for Databases, PostgreSQL prebuilt: list tables and schemas, inspect indexes, locks and query plans, and run SQL (29 tools). Replaces the postgres entry removed in v1.2.0 (@modelcontextprotocol/server-postgres: deprecated, with an SQL injection that escapes its read-only mode) — if you installed that one, remove it with `claude mcp remove postgres`. `execute_sql` has no read-only mode: it runs whatever the database role may run.",
      "recommend_if": "The project talks to PostgreSQL (pg, postgres, psycopg, asyncpg, a prisma/sqlalchemy postgresql datasource, or a postgres service in docker-compose) and you want the agent to inspect the schema or data. Connect with a dedicated role granted only what the agent should do (SELECT alone for read-only): the server enforces privileges, so SQL cannot escape them the way it escaped the old read-only wrapper. Never a production database without explicit approval.",
      "source": "https://mcp-toolbox.dev/integrations/postgres/prebuilt-configs/postgresql/",
      "requires_input": [
        "POSTGRES_HOST, POSTGRES_PORT and POSTGRES_DATABASE of the database to inspect",
        "POSTGRES_USER and POSTGRES_PASSWORD of a dedicated least-privilege role (SELECT-only for read-only use) — never an owner, admin, migration, or application-write account"
      ],
      "claude": { "scope": "local", "command": "npx", "args": ["-y", "@toolbox-sdk/server@1.12.0", "--prebuilt", "postgres", "--stdio"], "env": { "POSTGRES_HOST": "<host>", "POSTGRES_PORT": "5432", "POSTGRES_DATABASE": "<database>", "POSTGRES_USER": "<least-privilege-role>", "POSTGRES_PASSWORD": "<password>" } },
      "opencode": { "command": "npx", "args": ["-y", "@toolbox-sdk/server@1.12.0", "--prebuilt", "postgres", "--stdio"], "env": { "POSTGRES_HOST": "<host>", "POSTGRES_PORT": "5432", "POSTGRES_DATABASE": "<database>", "POSTGRES_USER": "<least-privilege-role>", "POSTGRES_PASSWORD": "<password>" } }
    },
    {
      "id": "toolbox-sqlite",
      "name": "SQLite (Google MCP Toolbox)",
      "kind": "mcp",
      "summary": "Google's MCP Toolbox for Databases, SQLite prebuilt: `list_tables` and `execute_sql` on one database file. Replaces the sqlite entry removed in v1.2.0 (its npm package never existed; the official Python server has an SQL injection that will not be fixed). `execute_sql` runs any statement: a `file:<path>?mode=ro` URI stops accidental writes, but ATTACH can reopen the file read-write (verified), so it is not a security boundary.",
      "recommend_if": "The project has a *.db, *.sqlite or *.sqlite3 file or a sqlite dependency, and you want the agent to query it. Point it at a copy of the file, never the only copy of data you care about.",
      "source": "https://mcp-toolbox.dev/integrations/sqlite/prebuilt-configs/sqlite/",
      "requires_input": [
        "SQLITE_DATABASE — path to a copy of the database file (as file:<path>?mode=ro to stop accidental writes)"
      ],
      "claude": { "scope": "local", "command": "npx", "args": ["-y", "@toolbox-sdk/server@1.12.0", "--prebuilt", "sqlite", "--stdio"], "env": { "SQLITE_DATABASE": "file:<path-to-a-copy.db>?mode=ro" } },
      "opencode": { "command": "npx", "args": ["-y", "@toolbox-sdk/server@1.12.0", "--prebuilt", "sqlite", "--stdio"], "env": { "SQLITE_DATABASE": "file:<path-to-a-copy.db>?mode=ro" } }
    },
    {
      "id": "github",
      "name": "GitHub Copilot MCP",
      "kind": "mcp",
      "summary": "Direct GitHub API access (issues, PRs, repo search) through GitHub's own Copilot MCP endpoint, instead of shelling out to `gh` via Bash for everything. Moved here from base_project's always-on default set — it needs a real personal access token to work at all, which can't be an always-on default (found broken with a literal placeholder token registered, see dev/ROADMAP.md item 42).",
      "recommend_if": "You work with GitHub issues/PRs/repos often enough that `gh`-via-Bash friction is worth trading for a real MCP integration.",
      "source": "https://github.com/github/github-mcp-server",
      "requires_input": ["A GitHub personal access token (fine-grained, scoped to only what you need) — yours, never a shared/placeholder value"],
      "claude_only": true,
      "manual": true,
      "claude": { "instruction": "claude mcp add --scope user --transport http github https://api.githubcopilot.com/mcp/ --header \"Authorization: Bearer <your-real-token>\"" }
    },
    {
      "id": "filesystem",
      "name": "Filesystem MCP",
      "kind": "mcp",
      "summary": "Reads, writes and searches files through MCP, confined to the directories passed as arguments. Part of base_project's always-on set until v1.2.0 — removed because Claude Code, opencode and Codex already have native file tools (GOALS 9 measured zero calls in 16 days).",
      "recommend_if": "Only on explicit request — e.g. to confine a client without native file tools to specific directories. A coding agent with its own file tools gains nothing from it.",
      "source": "https://github.com/modelcontextprotocol/servers/tree/main/src/filesystem",
      "claude": { "scope": "local", "command": "npx", "args": ["-y", "@modelcontextprotocol/server-filesystem@2026.8.31", "."] },
      "opencode": { "command": "npx", "args": ["-y", "@modelcontextprotocol/server-filesystem@2026.8.31", "."] }
    },
    {
      "id": "git",
      "name": "Git MCP (official)",
      "kind": "mcp",
      "summary": "Git status, diff, log, branch and commit tools through MCP — the official reference server (Python, run with uvx). Replaces the `mcp-git` npm package base_project kept always-on until v1.2.0 (individual maintainer, unpinned, zero measured calls).",
      "recommend_if": "Only on explicit request — the agents already run git through their shell.",
      "source": "https://github.com/modelcontextprotocol/servers/tree/main/src/git",
      "requires": ["uv (provides uvx)"],
      "claude": { "scope": "local", "command": "uvx", "args": ["mcp-server-git@2026.8.18"] },
      "opencode": { "command": "uvx", "args": ["mcp-server-git@2026.8.18"] }
    },
    {
      "id": "strix",
      "name": "Strix",
      "kind": "cli",
      "summary": "Autonomous AI pentest agent — explores, exploits, and proves vulnerabilities with working PoCs instead of a static scan list. Runs sandboxed in Docker. Used by /audit when installed.",
      "recommend_if": "The project handles auth, payments, or user data, or the user wants deeper coverage than npm audit / gitleaks for /audit.",
      "source": "https://github.com/usestrix/strix",
      "requires": ["Docker running locally"],
      "install": {
        "command": "pip",
        "args": ["install", "strix-agent"],
        "note": "Reported by this project's own maintainer: strix has exceeded the token/context budget before finishing a run, on a real project — it did not complete. Confirm scope/timeout/target-size settings (see the project's own docs for limiting run size) before relying on it; don't assume a completed run without checking."
      }
    },
    {
      "id": "skill-ui",
      "pluginName": "frontend-design",
      "name": "Skill UI bundle (frontend-design + baseline-ui)",
      "kind": "skill",
      "summary": "Design-quality skills: /frontend-design generates a real design direction instead of a generic template, /baseline-ui strips 'agent UI slop' (spacing, typography, states), /fixing-accessibility covers keyboard/labels/focus.",